paperID|doi|journal_name|pages|abstract|publicationVenue_id|publicationVenue_name|title|year|authorIDs|authorNames|fields
4b149a326e38b9237077d794a0d5f5b4865efacf|10.1109/TAFFC.2017.2740923|IEEE Transactions on Affective Computing|18-31|Automated affective computing in the wild setting is a challenging problem in computer vision. Existing annotated databases of facial expressions in the wild are small and mostly cover discrete emotions (aka the categorical model). There are very limited annotated facial databases for affective computing in the continuous dimensional model (e.g., valence and arousal). To meet this need, we collected, annotated, and prepared for public distribution a new database of facial emotions in the wild (called AffectNet). AffectNet contains more than 1,000,000 facial images from the Internet by querying three major search engines using 1,250 emotion related keywords in six different languages. About half of the retrieved images were manually annotated for the presence of seven discrete facial expressions and the intensity of valence and arousal. AffectNet is by far the largest database of facial expression, valence, and arousal in the wild enabling research in automated facial expression recognition in two different emotion models. Two baseline deep neural networks are used to classify images in the categorical model and predict the intensity of valence and arousal. Various evaluation metrics show that our deep neural network baselines can perform better than conventional machine learning methods and off-the-shelf facial expression recognition systems.|a88e2a6c-903f-42e1-8dfc-f2547e32020a|IEEE Transactions on Affective Computing|AffectNet: A Database for Facial Expression, Valence, and Arousal Computing in the Wild|2017|2314025;9706655;145531712|A. Mollahosseini;Behzad Hasani;M. Mahoor|Computer Science
8346b9a8e156d6e7a7012bcd47bc4f5d4be59e92|10.1109/SP.2010.25|2010 IEEE Symposium on Security and Privacy|305-316|"In network intrusion detection research, one popular strategy for finding attacks is monitoring a network's activity for anomalies: deviations from profiles of normality previously learned from benign traffic, typically identified using tools borrowed from the machine learning community. However, despite extensive academic research one finds a striking gap in terms of actual deployments of such systems: compared with other intrusion detection approaches, machine learning is rarely employed in operational ""real world"" settings. We examine the differences between the network intrusion detection problem and other areas where machine learning regularly finds much more success. Our main claim is that the task of finding attacks is fundamentally different from these other applications, making it significantly harder for the intrusion detection community to employ machine learning effectively. We support this claim by identifying challenges particular to network intrusion detection, and provide a set of guidelines meant to strengthen future research on anomaly detection."|29b9c461-963e-4d11-b2ab-92c182243942|IEEE Symposium on Security and Privacy|Outside the Closed World: On Using Machine Learning for Network Intrusion Detection|2010|1690799;1744800|Robin Sommer;V. Paxson|Computer Science
220ac48a22547a455d05f416e1fd22bbd0b0788d|10.1109/CVPR.2017.18|2017 IEEE Conference on Computer Vision and Pattern Recognition (CVPR)|95-104|Collecting well-annotated image datasets to train modern machine learning algorithms is prohibitively expensive for many tasks. One appealing alternative is rendering synthetic data where ground-truth annotations are generated automatically. Unfortunately, models trained purely on rendered images fail to generalize to real images. To address this shortcoming, prior work introduced unsupervised domain adaptation algorithms that have tried to either map representations between the two domains, or learn to extract features that are domain-invariant. In this work, we approach the problem in a new light by learning in an unsupervised manner a transformation in the pixel space from one domain to the other. Our generative adversarial network (GAN)-based method adapts source-domain images to appear as if drawn from the target domain. Our approach not only produces plausible samples, but also outperforms the state-of-the-art on a number of unsupervised domain adaptation scenarios by large margins. Finally, we demonstrate that the adaptation process generalizes to object classes unseen during training.|768b87bb-8a18-4d9c-a161-4d483c776bcf|Computer Vision and Pattern Recognition|Unsupervised Pixel-Level Domain Adaptation with Generative Adversarial Networks|2016|2732737;2286640;35363891;1761978;1707347|Konstantinos Bousmalis;N. Silberman;David Dohan;D. Erhan;Dilip Krishnan|Computer Science
b8ff8c7ab23eb70d4179c15a8a6b0efa1a493b8b|10.1109/JRPROC.1961.287775|Proceedings of the IRE|8-30|The problems of heuristic programming-of making computers solve really difficult problems-are divided into five main areas: Search, Pattern-Recognition, Learning, Planning, and Induction. A computer can do, in a sense, only what it is told to do. But even when we do not know how to solve a certain problem, we may program a machine (computer) to Search through some large space of solution attempts. Unfortunately, this usually leads to an enormously inefficient process. With Pattern-Recognition techniques, efficiency can often be improved, by restricting the application of the machine's methods to appropriate problems. Pattern-Recognition, together with Learning, can be used to exploit generalizations based on accumulated experience, further reducing search. By analyzing the situation, using Planning methods, we may obtain a fundamental improvement by replacing the given search with a much smaller, more appropriate exploration. To manage broad classes of problems, machines will need to construct models of their environments, using some scheme for Induction. Wherever appropriate, the discussion is supported by extensive citation of the literature and by descriptions of a few of the most successful heuristic (problem-solving) programs constructed to date.|82b56675-f0f3-487f-b83e-155a762e2855|Proceedings of the IRE|Steps toward Artificial Intelligence|1995|1847175|M. Minsky|Computer Science
ffa6396d0749697fc11e24a5d9ce53f8bf10c1fc|10.1109/MVT.2019.2921208|IEEE Vehicular Technology Magazine|28-41|A key enabler for the intelligent information society of 2030, 6G networks are expected to provide performance superior to 5G and satisfy emerging services and applications. In this article, we present our vision of what 6G will be and describe usage scenarios and requirements for multi-terabyte per second (Tb/s) and intelligent 6G networks. We present a large-dimensional and autonomous network architecture that integrates space, air, ground, and underwater networks to provide ubiquitous and unlimited wireless connectivity. We also discuss artificial intelligence (AI) and machine learning [1], [2] for autonomous networks and innovative air-interface design. Finally, we identify several promising technologies for the 6G ecosystem, including terahertz (THz) communications, very-large-scale antenna arrays [i.e., supermassive (SM) multiple-input, multiple-output (MIMO)], large intelligent surfaces (LISs) and holographic beamforming (HBF), orbital angular momentum (OAM) multiplexing, laser and visible-light communications (VLC), blockchain-based spectrum sharing, quantum communications and computing, molecular communications, and the Internet of Nano-Things.|5f700bd7-638a-4bee-8ca7-3c7bff9eaf9d|IEEE Vehicular Technology Magazine|6G Wireless Networks: Vision, Requirements, Architecture, and Key Technologies|2019|103010565;1749827;1730232;2263629384;144095199;2301538;144015029;145563833|Zhengquan Zhang;Yue Xiao;Zheng Ma;Ming Xiao;Z. Ding;Xianfu Lei;G. Karagiannidis;P. Fan|Engineering;Computer Science;Environmental Science
7380e343dd4547e21d5118b16daf03d021d98c4e|10.1109/ICCV.2017.371|2017 IEEE International Conference on Computer Vision (ICCV)|3449-3457|As machine learning algorithms are increasingly applied to high impact yet high risk tasks, such as medical diagnosis or autonomous driving, it is critical that researchers can explain how such algorithms arrived at their predictions. In recent years, a number of image saliency methods have been developed to summarize where highly complex neural networks “look” in an image for evidence for their predictions. However, these techniques are limited by their heuristic nature and architectural constraints. In this paper, we make two main contributions: First, we propose a general framework for learning different kinds of explanations for any black box algorithm. Second, we specialise the framework to find the part of an image most responsible for a classifier decision. Unlike previous works, our method is model-agnostic and testable because it is grounded in explicit and interpretable image perturbations.|7654260e-79f9-45c5-9663-d72027cf88f3|IEEE International Conference on Computer Vision|Interpretable Explanations of Black Boxes by Meaningful Perturbation|2017|25576460;1687524|Ruth C. Fong;A. Vedaldi|Mathematics;Computer Science
36d442f59c61ea2912d227c24dee76778c546b0a|10.1109/JPROC.2018.2820126|Proceedings of the IEEE|808-828|Research in graph signal processing (GSP) aims to develop tools for processing data defined on irregular graph domains. In this paper, we first provide an overview of core ideas in GSP and their connection to conventional digital signal processing, along with a brief historical perspective to highlight how concepts recently developed in GSP build on top of prior research in other areas. We then summarize recent advances in developing basic GSP tools, including methods for sampling, filtering, or graph learning. Next, we review progress in several application areas using GSP, including processing and analysis of sensor network data, biological data, and applications to image processing and machine learning.|6faaccca-1cc4-45a9-aeb6-96a4901d2606|Proceedings of the IEEE|Graph Signal Processing: Overview, Challenges, and Applications|2017|145029825;1703189;2442915;51283515;1697397|Antonio Ortega;P. Frossard;J. Kovacevic;J. Moura;P. Vandergheynst|Engineering;Computer Science;Environmental Science
afa778ba0ba6333e25671cfb691a4bdda13b2868|10.1109/TIFS.2020.2988575|IEEE Transactions on Information Forensics and Security|3454-3469|"Federated learning (FL), as a type of distributed machine learning, is capable of significantly preserving clients’ private data from being exposed to adversaries. Nevertheless, private information can still be divulged by analyzing uploaded parameters from clients, e.g., weights trained in deep neural networks. In this paper, to effectively prevent information leakage, we propose a novel framework based on the concept of differential privacy (DP), in which artificial noise is added to parameters at the clients’ side before aggregating, namely, noising before model aggregation FL (NbAFL). First, we prove that the NbAFL can satisfy DP under distinct protection levels by properly adapting different variances of artificial noise. Then we develop a theoretical convergence bound on the loss function of the trained FL model in the NbAFL. Specifically, the theoretical bound reveals the following three key properties: 1) there is a tradeoff between convergence performance and privacy protection levels, i.e., better convergence performance leads to a lower protection level; 2) given a fixed privacy protection level, increasing the number <inline-formula> <tex-math notation=""LaTeX"">$N$ </tex-math></inline-formula> of overall clients participating in FL can improve the convergence performance; and 3) there is an optimal number aggregation times (communication rounds) in terms of convergence performance for a given protection level. Furthermore, we propose a <inline-formula> <tex-math notation=""LaTeX"">$K$ </tex-math></inline-formula>-client random scheduling strategy, where <inline-formula> <tex-math notation=""LaTeX"">$K$ </tex-math></inline-formula> (<inline-formula> <tex-math notation=""LaTeX"">$1\leq K< N$ </tex-math></inline-formula>) clients are randomly selected from the <inline-formula> <tex-math notation=""LaTeX"">$N$ </tex-math></inline-formula> overall clients to participate in each aggregation. We also develop a corresponding convergence bound for the loss function in this case and the <inline-formula> <tex-math notation=""LaTeX"">$K$ </tex-math></inline-formula>-client random scheduling strategy also retains the above three properties. Moreover, we find that there is an optimal <inline-formula> <tex-math notation=""LaTeX"">$K$ </tex-math></inline-formula> that achieves the best convergence performance at a fixed privacy level. Evaluations demonstrate that our theoretical results are consistent with simulations, thereby facilitating the design of various privacy-preserving FL algorithms with different tradeoff requirements on convergence performance and privacy levels."|d406a3f4-dc05-43be-b1f6-812f29de9c0e|IEEE Transactions on Information Forensics and Security|Federated Learning With Differential Privacy: Algorithms and Performance Analysis|2019|145158805;145409858;145573463;144496518;8896870;2083526329;145824256;1718541;145967056|Kang Wei;Jun Li;Ming Ding;Chuan Ma;H. Yang;Farokhi Farhad;Shi Jin;Tony Q. S. Quek;H. Poor|Mathematics;Computer Science
872bae24c109f7c30e052ac218b17a8b028d08a0|10.1162/NECO_a_00142|Neural Computation|1661-1674|Denoising autoencoders have been previously shown to be competitive alternatives to restricted Boltzmann machines for unsupervised pretraining of each layer of a deep architecture. We show that a simple denoising autoencoder training criterion is equivalent to matching the score (with respect to the data) of a specific energy-based model to that of a nonparametric Parzen density estimator of the data. This yields several useful insights. It defines a proper probabilistic model for the denoising autoencoder technique, which makes it in principle possible to sample from them or rank examples by their energy. It suggests a different way to apply score matching that is related to learning to denoise and does not require computing second derivatives. It justifies the use of tied weights between the encoder and decoder and suggests ways to extend the success of denoising autoencoders to a larger family of energy-based models.|69b9bcdd-8229-4a00-a6e0-00f0e99a2bf3|Neural Computation|A Connection Between Score Matching and Denoising Autoencoders|2011|145467703|Pascal Vincent|Medicine;Mathematics;Computer Science
b57c54350769ffa59ff57f79ee5aad918844d298|10.5555/1953048.2021036|Journal of machine learning research : JMLR|"
          1069-1109
        "|Privacy-preserving machine learning algorithms are crucial for the increasingly common setting in which personal data, such as medical or financial records, are analyzed. We provide general techniques to produce privacy-preserving approximations of classifiers learned via (regularized) empirical risk minimization (ERM). These algorithms are private under the ε-differential privacy definition due to Dwork et al. (2006). First we apply the output perturbation ideas of Dwork et al. (2006), to ERM classification. Then we propose a new method, objective perturbation, for privacy-preserving machine learning algorithm design. This method entails perturbing the objective function before optimizing over classifiers. If the loss and regularizer satisfy certain convexity and differentiability criteria, we prove theoretical results showing that our algorithms preserve privacy, and provide generalization bounds for linear and nonlinear kernels. We further present a privacy-preserving technique for tuning the parameters in general machine learning algorithms, thereby providing end-to-end privacy guarantees for the training process. We apply these results to produce privacy-preserving analogues of regularized logistic regression and support vector machines. We obtain encouraging results from evaluating their performance on real demographic and benchmark data sets. Our results show that both theoretically and empirically, objective perturbation is superior to the previous state-of-the-art, output perturbation, in managing the inherent tradeoff between privacy and learning performance.|c22e7c36-3bfa-43e1-bb7b-edccdea2a780|Journal of machine learning research|Differentially Private Empirical Risk Minimization|2009|38120884;1806678;9208982|Kamalika Chaudhuri;C. Monteleoni;A. Sarwate|Medicine;Mathematics;Computer Science
9d3e0fce253a4ae4a4456b2f24c03329a2b74621|10.1109/JBHI.2016.2636665|IEEE Journal of Biomedical and Health Informatics|4-21|With a massive influx of multimodality data, the role of data analytics in health informatics has grown rapidly in the last decade. This has also prompted increasing interests in the generation of analytical, data driven models based on machine learning in health informatics. Deep learning, a technique with its foundation in artificial neural networks, is emerging in recent years as a powerful tool for machine learning, promising to reshape the future of artificial intelligence. Rapid improvements in computational power, fast data storage, and parallelization have also contributed to the rapid uptake of the technology in addition to its predictive power and ability to generate automatically optimized high-level features and semantic interpretation from the input data. This article presents a comprehensive up-to-date review of research employing deep learning in health informatics, providing a critical analysis of the relative merit, and potential pitfalls of the technique as well as its future outlook. The paper mainly focuses on key applications of deep learning in the fields of translational bioinformatics, medical imaging, pervasive sensing, medical informatics, and public health.|eac74c9c-a5c0-417d-8088-8164a6a8bfb3|IEEE journal of biomedical and health informatics|Deep Learning for Health Informatics|2017|2347855602;1905807;2775904;3163767;1443783456;1745644;144574968|Daniele Ravì;Charence Wong;F. Deligianni;M. Berthelot;Javier Andreu-Perez;Benny P. L. Lo;Guang-Zhong Yang|Medicine;Computer Science
3b7d120c0e801ef318bc9c607a0789f175637c7f|10.1109/FG.2018.00019|2018 13th IEEE International Conference on Automatic Face & Gesture Recognition (FG 2018)|59-66|Over the past few years, there has been an increased interest in automatic facial behavior analysis and understanding. We present OpenFace 2.0 - a tool intended for computer vision and machine learning researchers, affective computing community and people interested in building interactive applications based on facial behavior analysis. OpenFace 2.0 is an extension of OpenFace toolkit and is capable of more accurate facial landmark detection, head pose estimation, facial action unit recognition, and eye-gaze estimation. The computer vision algorithms which represent the core of OpenFace 2.0 demonstrate state-of-the-art results in all of the above mentioned tasks. Furthermore, our tool is capable of real-time performance and is able to run from a simple webcam without any specialist hardware. Finally, unlike a lot of modern approaches or toolkits, OpenFace 2.0 source code for training models and running them is freely available for research purposes.|b0c05768-6345-45d7-b541-235edf6ead54|IEEE International Conference on Automatic Face & Gesture Recognition|OpenFace 2.0: Facial Behavior Analysis Toolkit|2018|1756344;144802290;144529448;49933077|T. Baltrušaitis;Amir Zadeh;Y. Lim;Louis-Philippe Morency|Computer Science
771479c18b586eafae21baf262a220aaa7b2eef6|10.1109/TGRS.2016.2601622|IEEE Transactions on Geoscience and Remote Sensing|7405-7415|Object detection in very high resolution optical remote sensing images is a fundamental problem faced for remote sensing image analysis. Due to the advances of powerful feature representations, machine-learning-based object detection is receiving increasing attention. Although numerous feature representations exist, most of them are handcrafted or shallow-learning-based features. As the object detection task becomes more challenging, their description capability becomes limited or even impoverished. More recently, deep learning algorithms, especially convolutional neural networks (CNNs), have shown their much stronger feature representation power in computer vision. Despite the progress made in nature scene images, it is problematic to directly use the CNN feature for object detection in optical remote sensing images because it is difficult to effectively deal with the problem of object rotation variations. To address this problem, this paper proposes a novel and effective approach to learn a rotation-invariant CNN (RICNN) model for advancing the performance of object detection, which is achieved by introducing and learning a new rotation-invariant layer on the basis of the existing CNN architectures. However, different from the training of traditional CNN models that only optimizes the multinomial logistic regression objective, our RICNN model is trained by optimizing a new objective function via imposing a regularization constraint, which explicitly enforces the feature representations of the training samples before and after rotating to be mapped close to each other, hence achieving rotation invariance. To facilitate training, we first train the rotation-invariant layer and then domain-specifically fine-tune the whole RICNN network to further boost the performance. Comprehensive evaluations on a publicly available ten-class object detection data set demonstrate the effectiveness of the proposed method.|70628d6a-97aa-4571-9701-bc0eb3989c32|IEEE Transactions on Geoscience and Remote Sensing|Learning Rotation-Invariant Convolutional Neural Networks for Object Detection in VHR Optical Remote Sensing Images|2016|2152127024;2895041;7181955|Gong Cheng;Peicheng Zhou;Junwei Han|Engineering;Computer Science;Environmental Science
8ccdee6826cbc97256bd4d082ebfa8cdfd2c727f|10.1126/science.aaw4741|Science|1026 - 1030|Machine-learning fluid flow Quantifying fluid flow is relevant to disciplines ranging from geophysics to medicine. Flow can be experimentally visualized using, for example, smoke or contrast agents, but extracting velocity and pressure fields from this information is tricky. Raissi et al. developed a machine-learning approach to tackle this problem. Their method exploits the knowledge of Navier-Stokes equations, which govern the dynamics of fluid flow in many scientifically relevant situations. The authors illustrate their approach using examples such as blood flow in an aneurysm. Science, this issue p. 1026 A machine learning approach exploiting the knowledge of Navier-Stokes equations can extract detailed fluid flow information. For centuries, flow visualization has been the art of making fluid motion visible in physical and biological systems. Although such flow patterns can be, in principle, described by the Navier-Stokes equations, extracting the velocity and pressure fields directly from the images is challenging. We addressed this problem by developing hidden fluid mechanics (HFM), a physics-informed deep-learning framework capable of encoding the Navier-Stokes equations into the neural networks while being agnostic to the geometry or the initial and boundary conditions. We demonstrate HFM for several physical and biomedical problems by extracting quantitative information for which direct measurements may not be possible. HFM is robust to low resolution and substantial noise in the observation data, which is important for potential applications.|f59506a8-d8bb-4101-b3d4-c4ac3ed03dad|Science|Hidden fluid mechanics: Learning velocity and pressure fields from flow visualizations|2020|145401977;37412357;1720124|M. Raissi;A. Yazdani;G. Karniadakis|Medicine;Engineering;Physics;Computer Science
cedea36fa3692281b3ac767335fe49a16d00957d|10.1111/AJPS.12103|American Journal of Political Science|1064-1082|Collection and especially analysis of open-ended survey responses are relatively rare in the discipline and when conducted are almost exclusively done through human coding. We present an alternative, semiautomated approach, the structural topic model (STM) (Roberts, Stewart, and Airoldi 2013; Roberts et al. 2013), that draws on recent developments in machine learning based analysis of textual data. A crucial contribution of the method is that it incorporates information about the document, such as the author's gender, political affiliation, and treatment assignment (if an experimental study). This article focuses on how the STM is helpful for survey researchers and experimentalists. The STM makes analyzing open-ended responses easier, more revealing, and capable of being used to estimate treatment effects. We illustrate these innovations with analysis of text from surveys and experiments.|17c57465-210d-4f43-a033-59d25938d6b6|American Journal of Political Science|Structural Topic Models for Open‐Ended Survey Responses|2014|2464550;28924497;3252940;2061550766;1403360325;13901928;50483051;2157480|Margaret E. Roberts;Brandon M Stewart;D. Tingley;Christopher Lucas;Jetson Leder-Luis;S. Gadarian;B. Albertson;David G. Rand|Computer Science
