paperID|doi|journal_name|pages|abstract|publicationVenue_id|publicationVenue_name|title|year|authorIDs|authorNames|fields
4f71ab367eb37cfd145d41327f7bb14077e5e7c5|10.1109/TGRS.2019.2907932|IEEE Transactions on Geoscience and Remote Sensing|6690-6709|Hyperspectral image (HSI) classification has become a hot topic in the field of remote sensing. In general, the complex characteristics of hyperspectral data make the accurate classification of such data challenging for traditional machine learning methods. In addition, hyperspectral imaging often deals with an inherently nonlinear relation between the captured spectral information and the corresponding materials. In recent years, deep learning has been recognized as a powerful feature-extraction tool to effectively address nonlinear problems and widely used in a number of image processing tasks. Motivated by those successful applications, deep learning has also been introduced to classify HSIs and demonstrated good performance. This survey paper presents a systematic review of deep learning-based HSI classification literatures and compares several strategies for this topic. Specifically, we first summarize the main challenges of HSI classification which cannot be effectively overcome by traditional machine learning methods, and also introduce the advantages of deep learning to handle these problems. Then, we build a framework that divides the corresponding works into spectral-feature networks, spatial-feature networks, and spectral–spatial-feature networks to systematically review the recent achievements in deep learning-based HSI classification. In addition, considering the fact that available training samples in the remote sensing field are usually very limited and training deep networks require a large number of samples, we include some strategies to improve classification performance, which can provide some guidelines for future studies on this topic. Finally, several representative deep learning-based classification methods are conducted on real HSIs in our experiments.|70628d6a-97aa-4571-9701-bc0eb3989c32|IEEE Transactions on Geoscience and Remote Sensing|Deep Learning for Hyperspectral Image Classification: An Overview|2019|2116066317;145273596;38140728;2597809;2370080;1682001|Shutao Li;Weiwei Song;Leyuan Fang;Yushi Chen;Pedram Ghamisi;J. Benediktsson|Engineering;Computer Science;Environmental Science
5c5be36e3111e42247d78a6d529e4b1d7d2ced12|10.1109/ISBI.2011.5872394|2011 IEEE International Symposium on Biomedical Imaging: From Nano to Macro|230-233|Segmentation is the process of partitioning digital images into meaningful regions. The analysis of biological high content images often requires segmentation as a first step. We propose ilastik as an easy-to-use tool which allows the user without expertise in image processing to perform segmentation and classification in a unified way. ilastik learns from labels provided by the user through a convenient mouse interface. Based on these labels, ilastik infers a problem specific segmentation. A random forest classifier is used in the learning step, in which each pixel's neighborhood is characterized by a set of generic (nonlinear) features. ilastik supports up to three spatial plus one spectral dimension and makes use of all dimensions in the feature calculation. ilastik provides realtime feedback that enables the user to interactively refine the segmentation result and hence further fine-tune the classifier. An uncertainty measure guides the user to ambiguous regions in the images. Real time performance is achieved by multi-threading which fully exploits the capabilities of modern multi-core machines. Once a classifier has been trained on a set of representative images, it can be exported and used to automatically process a very large number of images (e.g. using the CellProfiler pipeline). ilastik is an open source project and released under the BSD license at www.ilastik.org.|a38e0d3d-6929-4868-b4e4-af8bbacf711e|IEEE International Symposium on Biomedical Imaging|Ilastik: Interactive learning and segmentation toolkit|2011|2059204163;145486652;1708103;1685187|Christoph Sommer;C. Straehle;U. Köthe;F. Hamprecht|Biology;Computer Science
5cbe278b65a81602a864184bbca37de91448a5f5|10.1126/science.abq1158|Science|1092 - 1097|Programming is a powerful and ubiquitous problem-solving tool. Systems that can assist programmers or even generate programs themselves could make programming more productive and accessible. Recent transformer-based neural network models show impressive code generation abilities yet still perform poorly on more complex tasks requiring problem-solving skills, such as competitive programming problems. Here, we introduce AlphaCode, a system for code generation that achieved an average ranking in the top 54.3% in simulated evaluations on recent programming competitions on the Codeforces platform. AlphaCode solves problems by generating millions of diverse programs using specially trained transformer-based networks and then filtering and clustering those programs to a maximum of just 10 submissions. This result marks the first time an artificial intelligence system has performed competitively in programming competitions. Description Machine learning systems can program too Computer programming competitions are popular tests among programmers that require critical thinking informed by experience and creating solutions to unforeseen problems, both of which are key aspects of human intelligence but challenging to mimic by machine learning models. Using self-supervised learning and an encoder-decoder transformer architecture, Li et al. developed AlphaCode, a deep-learning model that can achieve approximately human-level performance on the Codeforces platform, which regularly hosts these competitions and attracts numerous participants worldwide (see the Perspective by Kolter). The development of such coding platforms could have a huge impact on programmers’ productivity. It may even change the culture of programming by shifting human work to formulating problems, with machine learning being the main one responsible for generating and executing codes. —YS Modern machine learning systems can achieve average human-level performance in popular competitive programming contests.|f59506a8-d8bb-4101-b3d4-c4ac3ed03dad|Science|Competition-level code generation with AlphaCode|2022|47002813;2114950020;8270717;1684887;4337102;37212795;2152472076;2152469120;2058168486;49423009;2152469362;2067208983;2070068655;2154435638;2152471553;2256699276;1425082935;2421691;1851564;2071666;2079024030;152394142;2065370007;3187297;2152471960;143967473;2152472162;2152469135;2645384;1689108|Yujia Li;David Choi;Junyoung Chung;Nate Kushman;Julian Schrittwieser;Rémi Leblond;Tom;Eccles;James Keeling;Felix Gimeno;A. D. Lago;T. Hubert;Peter Choy;Cyprien de;Masson d’Autume;Igor Babuschkin;Xinyun Chen;Po-Sen Huang;Johannes Welbl;Sven Gowal;Alexey;Cherepanov;James Molloy;D. Mankowitz;Esme Sutherland Robson;Pushmeet Kohli;Nando de;Freitas;K. Kavukcuoglu;O. Vinyals|Medicine;Computer Science
2077d0f30507d51a0d3bbec4957d55e817d66a59|10.1109/CVPR.2005.160|2005 IEEE Computer Society Conference on Computer Vision and Pattern Recognition (CVPR'05)|860-867 vol. 2|We develop a framework for learning generic, expressive image priors that capture the statistics of natural scenes and can be used for a variety of machine vision tasks. The approach extends traditional Markov random field (MRF) models by learning potential functions over extended pixel neighborhoods. Field potentials are modeled using a Products-of-Experts framework that exploits nonlinear functions of many linear filter responses. In contrast to previous MRF approaches all parameters, including the linear filters themselves, are learned from training data. We demonstrate the capabilities of this Field of Experts model with two example applications, image denoising and image inpainting, which are implemented using a simple, approximate inference scheme. While the model is trained on a generic image database and is not tuned toward a specific application, we obtain results that compete with and even outperform specialized techniques.|768b87bb-8a18-4d9c-a161-4d483c776bcf|Computer Vision and Pattern Recognition|Fields of Experts: a framework for learning image priors|2005|145920814;2105795|S. Roth;Michael J. Black|Computer Science
759d9a6c9206c366a8d94a06f4eb05659c2bb7f2|10.1109/TPAMI.2012.256|IEEE Transactions on Pattern Analysis and Machine Intelligence|1757-1772|To date, almost all experimental evaluations of machine learning-based recognition algorithms in computer vision have taken the form of “closed set” recognition, whereby all testing classes are known at training time. A more realistic scenario for vision applications is “open set” recognition, where incomplete knowledge of the world is present at training time, and unknown classes can be submitted to an algorithm during testing. This paper explores the nature of open set recognition and formalizes its definition as a constrained minimization problem. The open set recognition problem is not well addressed by existing algorithms because it requires strong generalization. As a step toward a solution, we introduce a novel “1-vs-set machine,” which sculpts a decision space from the marginal distances of a 1-class or binary SVM with a linear kernel. This methodology applies to several different applications in computer vision where open set recognition is a challenging problem, including object recognition and face verification. We consider both in this work, with large scale cross-dataset experiments performed over the Caltech 256 and ImageNet sets, as well as face matching experiments performed over the Labeled Faces in the Wild set. The experiments highlight the effectiveness of machines adapted for open set evaluation compared to existing 1-class and binary SVMs for the same tasks.|25248f80-fe99-48e5-9b8e-9baef3b8e23b|IEEE Transactions on Pattern Analysis and Machine Intelligence|Toward Open Set Recognition|2013|2613438;145603848;27469806;32163276|W. Scheirer;A. Rocha;Archana Sapkota;T. Boult|Medicine;Computer Science
1904d633fca15140e35d893637232803b6dde6d9|10.1109/TKDE.2018.2876857|IEEE Transactions on Knowledge and Data Engineering|2346-2363|Concept drift describes unforeseeable changes in the underlying distribution of streaming data over time. Concept drift research involves the development of methodologies and techniques for drift detection, understanding, and adaptation. Data analysis has revealed that machine learning in a concept drift environment will result in poor learning results if the drift is not addressed. To help researchers identify which research topics are significant and how to apply related techniques in data analysis tasks, it is necessary that a high quality, instructive review of current research developments and trends in the concept drift field is conducted. In addition, due to the rapid development of concept drift in recent years, the methodologies of learning under concept drift have become noticeably systematic, unveiling a framework which has not been mentioned in literature. This paper reviews over 130 high quality publications in concept drift related research areas, analyzes up-to-date developments in methodologies and techniques, and establishes a framework of learning under concept drift including three main components: concept drift detection, concept drift understanding, and concept drift adaptation. This paper lists and discusses 10 popular synthetic datasets and 14 publicly available benchmark datasets used for evaluating the performance of learning algorithms aiming at handling concept drift. Also, concept drift related research directions are covered and discussed. By providing state-of-the-art knowledge, this survey will directly support researchers in their understanding of research developments in the field of learning under concept drift.|c6840156-ee10-4d78-8832-7f8909811576|IEEE Transactions on Knowledge and Data Engineering|Learning under Concept Drift: A Review|2019|144864069;1471737704;46279367;2056183624;143931014;46266495|Jie Lu;Anjin Liu;Fan Dong;Feng Gu;João Gama;Guangquan Zhang|Mathematics;Computer Science
86f0b58404a264a6216e29c78a5c113d900ca461|10.1109/TBME.2015.2496264|IEEE Transactions on Biomedical Engineering|1455-1462|Today, medical image analysis papers require solid experiments to prove the usefulness of proposed methods. However, experiments are often performed on data selected by the researchers, which may come from different institutions, scanners, and populations. Different evaluation measures may be used, making it difficult to compare the methods. In this paper, we introduce a dataset of 7909 breast cancer histopathology images acquired on 82 patients, which is now publicly available from http://web.inf.ufpr.br/vri/breast-cancer-database. The dataset includes both benign and malignant images. The task associated with this dataset is the automated classification of these images in two classes, which would be a valuable computer-aided diagnosis tool for the clinician. In order to assess the difficulty of this task, we show some preliminary results obtained with state-of-the-art image classification systems. The accuracy ranges from 80% to 85%, showing room for improvement is left. By providing this dataset and a standardized evaluation protocol to the scientific community, we hope to gather researchers in both the medical and the machine learning field to advance toward this clinical application.|7c832ea7-321d-4d93-bbaf-281e9d6649d7|IEEE Transactions on Biomedical Engineering|A Dataset for Breast Cancer Histopathological Image Classification|2016|32786132;144925520;144518944;1804638|F. Spanhol;Luiz Oliveira;C. Petitjean;L. Heutte|Medicine;Computer Science
546785490ac417be1f83ced6a8272e934934f411|10.1093/annonc/mdy166|Annals of Oncology|1836–1842|"Background
Deep learning convolutional neural networks (CNN) may facilitate melanoma detection, but data comparing a CNN's diagnostic performance to larger groups of dermatologists are lacking.


Methods
Google's Inception v4 CNN architecture was trained and validated using dermoscopic images and corresponding diagnoses. In a comparative cross-sectional reader study a 100-image test-set was used (level-I: dermoscopy only; level-II: dermoscopy plus clinical information and images). Main outcome measures were sensitivity, specificity and area under the curve (AUC) of receiver operating characteristics (ROC) for diagnostic classification (dichotomous) of lesions by the CNN versus an international group of 58 dermatologists during level-I or -II of the reader study. Secondary end points included the dermatologists' diagnostic performance in their management decisions and differences in the diagnostic performance of dermatologists during level-I and -II of the reader study. Additionally, the CNN's performance was compared with the top-five algorithms of the 2016 International Symposium on Biomedical Imaging (ISBI) challenge.


Results
In level-I dermatologists achieved a mean (±standard deviation) sensitivity and specificity for lesion classification of 86.6% (±9.3%) and 71.3% (±11.2%), respectively. More clinical information (level-II) improved the sensitivity to 88.9% (±9.6%, P = 0.19) and specificity to 75.7% (±11.7%, P < 0.05). The CNN ROC curve revealed a higher specificity of 82.5% when compared with dermatologists in level-I (71.3%, P < 0.01) and level-II (75.7%, P < 0.01) at their sensitivities of 86.6% and 88.9%, respectively. The CNN ROC AUC was greater than the mean ROC area of dermatologists (0.86 versus 0.79, P < 0.01). The CNN scored results close to the top three algorithms of the ISBI 2016 challenge.


Conclusions
For the first time we compared a CNN's diagnostic performance with a large international group of 58 dermatologists, including 30 experts. Most dermatologists were outperformed by the CNN. Irrespective of any physicians' experience, they may benefit from assistance by a CNN's image classification.


Clinical trial number
This study was registered at the German Clinical Trial Register (DRKS-Study-ID: DRKS00013570; https://www.drks.de/drks_web/)."|9777e708-5066-48fd-ab6a-57496cbca033|Annals of Oncology|Man against machine: diagnostic performance of a deep learning convolutional neural network for dermoscopic melanoma recognition in comparison to 58 dermatologists|2018|5016554;49903386;5580228;2220290014;2223688580;2154835838;34445787;2080112167;2113670271;5840101;2213770;153454907;4023283;6486577;32147295;8735139;2154835838;1404268156;40398486;2135937978;2056204271;1422494434;3026399;4039707;8720212;2135937679;50009466;1471206276;33340370;144821090;1401706768;6248858;46486553;51289782;46560749;49551702;51952495;32516743;32084575;3698245;16126046;2348967;2842984;12155787;12565475;2056679749;46322047;36030514;2420136;4198024;145295514;2135990561;123257978;38676513;37936174;49785210;2102253685;5580228;1485389319;2220290014;41065919;2136001275;146218865;2055574299;117461896;6288635|H. Haenssle;C. Fink;R. Schneiderbauer;F. Toberer;T. Buhl;A. Blum;Aadi Kalloo;A. Hassen;L. Thomas;A. Enk;L. Uhlmann;C. Alt;M. Arenbergerova;R. Bakos;Anne Baltzer;I. Bertlich;A. Blum;Therezia Bokor-Billmann;J. Bowling;Naira Braghiroli;R. Braun;K. Buder-Bakhaya;T. Buhl;H. Cabo;L. Čabrijan;Naciye Cevic;A. Classen;David Deltgen;C. Fink;I. Georgieva;L. Hakim-Meibodi;Susanne Hanner;Franziska Hartmann;J. Hartmann;G. Haus;E. Hoxha;R. Karls;H. Koga;J. Kreusch;A. Lallas;P. Majenka;A. Marghoob;C. Massone;L. Mekokishvili;D. Mestel;Volker Meyer;A. Neuberger;K. Nielsen;M. Oliviero;R. Pampena;J. Paoli;Erika Pawlik;B. Rao;Adriana Rendon;T. Russo;Ahmed Sadek;K. Samhaber;R. Schneiderbauer;A. Schweizer;F. Toberer;L. Trennheuser;Lyobomira Vlahova;Alexander Wald;J. Winkler;Priscila Wölbing;I. Zalaudek|Medicine;Computer Science
1f6d30772a94d978c9f81e2f7c1f4b0bdec117dd|10.1109/CVPR.2019.00046|2019 IEEE/CVF Conference on Computer Vision and Pattern Recognition (CVPR)|374-382|Modern machine learning suffers from \textit{catastrophic forgetting} when learning new classes incrementally. The performance dramatically degrades due to the missing data of old classes. Incremental learning methods have been proposed to retain the knowledge acquired from the old classes, by using knowledge distilling and keeping a few exemplars from the old classes. However, these methods struggle to \textbf{scale up to a large number of classes}. We believe this is because of the combination of two factors: (a) the data imbalance between the old and new classes, and (b) the increasing number of visually similar classes. Distinguishing between an increasing number of visually similar classes is particularly challenging, when the training data is unbalanced. We propose a simple and effective method to address this data imbalance issue. We found that the last fully connected layer has a strong bias towards the new classes, and this bias can be corrected by a linear model. With two bias parameters, our method performs remarkably well on two large datasets: ImageNet (1000 classes) and MS-Celeb-1M (10000 classes), outperforming the state-of-the-art algorithms by 11.1\% and 13.2\% respectively.|768b87bb-8a18-4d9c-a161-4d483c776bcf|Computer Vision and Pattern Recognition|Large Scale Incremental Learning|2019|2119299240;2109306087;29957038;3105254;2145253136;3133575;46956675|Yue Wu;Yinpeng Chen;Lijuan Wang;Yuancheng Ye;Zicheng Liu;Yandong Guo;Y. Fu|Computer Science
91c380406f5a862b5937e70e720802e5c787968d|10.1162/coli.2008.34.1.125|Computational Linguistics|125-127|Text mining is the process of discovering information in large text collections, and automatically identifying interesting patterns and relationships in textual data. It is a relatively new research area, which has recently raised much interest among the research and industry communities, mainly due to the continuously increasing amount of information available on the Web and elsewhere. Text mining is a highly interdisci-plinary research area, bringing together research insights from the fields of data mining, natural language processing, machine learning, and information retrieval. In particular, text mining is closely related to the older area of data mining, which targets the extraction of interesting information from data records, although text mining is allegedly more difficult, as the source data consists of unstructured collections of documents rather than structured databases. The book by Feldman and Sanger is a thorough introduction to text mining, covering the general architecture of text mining systems, along with the main techniques used by such systems. It addresses both the theory and practice of text mining, and it illustrates the different techniques with real-world scenarios and practical applications. It is particularly relevant for students and professional practitioners, being structured as a self-contained handbook that does not require previous experience in any of the research fields involved. The book is structured into twelve chapters, which gradually introduce the area of text mining and related topics, starting with an introduction to the task of text mining, and ending with examples of practical applications from three different domains. The first chapter can be regarded as an overview of the book. It starts by defining the problem of text mining and the key elements in text mining: the document collections, the document features (words, terms, and concepts), and the role of background knowledge in text mining. It then briefly touches upon the possible applications of text mining, such as pattern discovery and trend analysis, and shortly discusses the interface layer of text mining systems. The second part of the chapter lays down the general architecture of a text mining system, which also serves as a rough guide for the rest of the book, as it describes the main components of a text mining system that are described in detail in subsequent chapters. Chapter 2 is one of the longest chapters in the book, and also one of the most dense in terms of newly introduced concepts. Despite being a more difficult read compared …|30a8645d-22d4-42e2-b3f6-304bf4ce3a02|International Conference on Computational Logic|Book Reviews: The Text Mining Handbook: Advanced Approaches to Analyzing Unstructured Data by Ronen Feldman and James Sanger|2008|145557251|Rada Mihalcea|Computer Science
6df11b0bb0244d4d36e8955436067cc5d19734fa|10.1109/TNNLS.2016.2599820|IEEE Transactions on Neural Networks and Learning Systems|2660-2673|Deep neural networks (DNNs) have demonstrated impressive performance in complex machine learning tasks such as image classification or speech recognition. However, due to their multilayer nonlinear structure, they are not transparent, i.e., it is hard to grasp what makes them arrive at a particular classification or recognition decision, given a new unseen data sample. Recently, several approaches have been proposed enabling one to understand and interpret the reasoning embodied in a DNN for a single test image. These methods quantify the “importance” of individual pixels with respect to the classification decision and allow a visualization in terms of a heatmap in pixel/input space. While the usefulness of heatmaps can be judged subjectively by a human, an objective quality measure is missing. In this paper, we present a general methodology based on region perturbation for evaluating ordered collections of pixels such as heatmaps. We compare heatmaps computed by three different methods on the SUN397, ILSVRC2012, and MIT Places data sets. Our main result is that the recently proposed layer-wise relevance propagation algorithm qualitatively and quantitatively provides a better explanation of what made a DNN arrive at a particular classification decision than the sensitivity-based approach or the deconvolution method. We provide theoretical arguments to explain this result and discuss its practical implications. Finally, we investigate the use of heatmaps for unsupervised assessment of the neural network performance.|79c5a18d-0295-432c-aaa5-961d73de6d88|IEEE Transactions on Neural Networks and Learning Systems|Evaluating the Visualization of What a Deep Neural Network Has Learned|2015|1699054;49345823;144535526;3633358;145034054|W. Samek;Alexander Binder;G. Montavon;S. Lapuschkin;K. Müller|Medicine;Computer Science
