paperID|doi|journal_name|pages|abstract|publicationVenue_id|publicationVenue_name|title|year|authorIDs|authorNames|fields
4d1fdd81f033cd58f3723bfc61e7d12079647a7a|10.1056/NEJMp1606181|The New England journal of medicine|"
          1216-9
        "|The algorithms of machine learning, which can sift through vast numbers of variables looking for combinations that reliably predict outcomes, will improve prognosis, displace much of the work of radiologists and anatomical pathologists, and improve diagnostic accuracy.|dc31f077-7737-4e33-baa3-bceeff44ec27|New England Journal of Medicine|Predicting the Future - Big Data, Machine Learning, and Clinical Medicine.|2016|3797258;39714312|Z. Obermeyer;E. Emanuel|Medicine;Computer Science
afcc28d71be4ea6a48a339f9e4e5557d1b2b25be|10.1109/TSMCC.2011.2161285|IEEE Transactions on Systems, Man, and Cybernetics, Part C (Applications and Reviews)|463-484|Classifier learning with data-sets that suffer from imbalanced class distributions is a challenging problem in data mining community. This issue occurs when the number of examples that represent one class is much lower than the ones of the other classes. Its presence in many real-world applications has brought along a growth of attention from researchers. In machine learning, the ensemble of classifiers are known to increase the accuracy of single classifiers by combining several of them, but neither of these learning techniques alone solve the class imbalance problem, to deal with this issue the ensemble learning algorithms have to be designed specifically. In this paper, our aim is to review the state of the art on ensemble techniques in the framework of imbalanced data-sets, with focus on two-class problems. We propose a taxonomy for ensemble-based methods to address the class imbalance where each proposal can be categorized depending on the inner ensemble methodology in which it is based. In addition, we develop a thorough empirical comparison by the consideration of the most significant published approaches, within the families of the taxonomy proposed, to show whether any of them makes a difference. This comparison has shown the good behavior of the simplest approaches which combine random undersampling techniques with bagging or boosting ensembles. In addition, the positive synergy between sampling techniques and bagging has stood out. Furthermore, our results show empirically that ensemble-based algorithms are worthwhile since they outperform the mere use of preprocessing techniques before learning the classifier, therefore justifying the increase of complexity by means of a significant enhancement of the results.|ecb11fdd-9e59-482f-a3b6-0cb14372306c|IEEE Transactions on Systems Man and Cybernetics Part C (Applications and Reviews)|A Review on Ensembles for the Class Imbalance Problem: Bagging-, Boosting-, and Hybrid-Based Approaches|2012|1924061;143741583;1695535;2256695032;2256697310|M. Galar;Alberto Fernández;E. Tartas;H. Bustince;F. Herrera|Computer Science
78989616eeeac55b202e3e4205225e7135054185|10.1109/TCCN.2017.2758370|IEEE Transactions on Cognitive Communications and Networking|563-575|We present and discuss several novel applications of deep learning for the physical layer. By interpreting a communications system as an autoencoder, we develop a fundamental new way to think about communications system design as an end-to-end reconstruction task that seeks to jointly optimize transmitter and receiver components in a single process. We show how this idea can be extended to networks of multiple transmitters and receivers and present the concept of radio transformer networks as a means to incorporate expert domain knowledge in the machine learning model. Lastly, we demonstrate the application of convolutional neural networks on raw IQ samples for modulation classification which achieves competitive accuracy with respect to traditional schemes relying on expert features. This paper is concluded with a discussion of open challenges and areas for future investigation.|65e58b80-9699-4da6-bd60-929b57b8533d|IEEE Transactions on Cognitive Communications and Networking|An Introduction to Deep Learning for the Physical Layer|2017|1388350203;1749686|Tim O'Shea;J. Hoydis|Mathematics;Engineering;Computer Science
a486e2839291111bb44fa1f07731ada123539f75|10.1162/tacl_a_00065|Transactions of the Association for Computational Linguistics|339-351|We propose a simple solution to use a single Neural Machine Translation (NMT) model to translate between multiple languages. Our solution requires no changes to the model architecture from a standard NMT system but instead introduces an artificial token at the beginning of the input sentence to specify the required target language. Using a shared wordpiece vocabulary, our approach enables Multilingual NMT systems using a single model. On the WMT’14 benchmarks, a single multilingual model achieves comparable performance for English→French and surpasses state-of-theart results for English→German. Similarly, a single multilingual model surpasses state-of-the-art results for French→English and German→English on WMT’14 and WMT’15 benchmarks, respectively. On production corpora, multilingual models of up to twelve language pairs allow for better translation of many individual pairs. Our models can also learn to perform implicit bridging between language pairs never seen explicitly during training, showing that transfer learning and zero-shot translation is possible for neural translation. Finally, we show analyses that hints at a universal interlingua representation in our models and also show some interesting examples when mixing languages.|e0dbf116-86aa-418d-859f-a49952d7e44a|Transactions of the Association for Computational Linguistics|Google’s Multilingual Neural Machine Translation System: Enabling Zero-Shot Translation|2016|2109675545;144927151;2827616;2048712;48607963;2545358;144203200;1765169;145233583;2227182886;48342565;2056946837|Melvin Johnson;M. Schuster;Quoc V. Le;M. Krikun;Yonghui Wu;Z. Chen;Nikhil Thorat;F. Viégas;M. Wattenberg;Gregory S. Corrado;Macduff Hughes;Jeffrey Dean|Linguistics;Computer Science
7ad66cba3b7e3abae7ef33122588512a146f7f77|10.1109/TKDE.2021.3070203|IEEE Transactions on Knowledge and Data Engineering|5586-5609|Multi-Task Learning (MTL) is a learning paradigm in machine learning and its aim is to leverage useful information contained in multiple related tasks to help improve the generalization performance of all the tasks. In this paper, we give a survey for MTL from the perspective of algorithmic modeling, applications and theoretical analyses. For algorithmic modeling, we give a definition of MTL and then classify different MTL algorithms into five categories, including feature learning approach, low-rank approach, task clustering approach, task relation learning approach and decomposition approach as well as discussing the characteristics of each approach. In order to improve the performance of learning tasks further, MTL can be combined with other learning paradigms including semi-supervised learning, active learning, unsupervised learning, reinforcement learning, multi-view learning and graphical models. When the number of tasks is large or the data dimensionality is high, we review online, parallel and distributed MTL models as well as dimensionality reduction and feature hashing to reveal their computational and storage advantages. Many real-world applications use MTL to boost their performance and we review representative works in this paper. Finally, we present theoretical analyses and discuss several future directions for MTL.|c6840156-ee10-4d78-8832-7f8909811576|IEEE Transactions on Knowledge and Data Engineering|A Survey on Multi-Task Learning|2017|46867608;152290618|Yu Zhang;Qiang Yang|Mathematics;Computer Science
3def68bd0f856886d34272840a7f81588f2bc082|10.1145/3571730|ACM Computing Surveys|1 - 38|Natural Language Generation (NLG) has improved exponentially in recent years thanks to the development of sequence-to-sequence deep learning technologies such as Transformer-based language models. This advancement has led to more fluent and coherent NLG, leading to improved development in downstream tasks such as abstractive summarization, dialogue generation, and data-to-text generation. However, it is also apparent that deep learning based generation is prone to hallucinate unintended text, which degrades the system performance and fails to meet user expectations in many real-world scenarios. To address this issue, many studies have been presented in measuring and mitigating hallucinated texts, but these have never been reviewed in a comprehensive manner before. In this survey, we thus provide a broad overview of the research progress and challenges in the hallucination problem in NLG. The survey is organized into two parts: (1) a general overview of metrics, mitigation methods, and future directions, and (2) an overview of task-specific research progress on hallucinations in the following downstream tasks, namely abstractive summarization, dialogue generation, generative question answering, data-to-text generation, and machine translation. This survey serves to facilitate collaborative efforts among researchers in tackling the challenge of hallucinated texts in NLG.|7b2adce0-d53f-49d6-8784-b0645604fe62|ACM Computing Surveys|Survey of Hallucination in Natural Language Generation|2022|3391272;40221187;1397300094;1660855299;49678544;98271906;38524906;23672613;94210578;47653392;2111680936;40539650|Ziwei Ji;Nayeon Lee;Rita Frieske;Tiezheng Yu;D. Su;Yan Xu;Etsuko Ishii;Yejin Bang;Delong Chen;Wenliang Dai;Andrea Madotto;Pascale Fung|Linguistics;Computer Science
0f5a0fbd07155cbf81ae9a5e76a1bc78da10a376|10.1109/COMST.2019.2902862|IEEE Communications Surveys & Tutorials|2334-2360|The use of flying platforms such as unmanned aerial vehicles (UAVs), popularly known as drones, is rapidly growing. In particular, with their inherent attributes such as mobility, flexibility, and adaptive altitude, UAVs admit several key potential applications in wireless systems. On the one hand, UAVs can be used as aerial base stations to enhance coverage, capacity, reliability, and energy efficiency of wireless networks. On the other hand, UAVs can operate as flying mobile terminals within a cellular network. Such cellular-connected UAVs can enable several applications ranging from real-time video streaming to item delivery. In this paper, a comprehensive tutorial on the potential benefits and applications of UAVs in wireless communications is presented. Moreover, the important challenges and the fundamental tradeoffs in UAV-enabled wireless networks are thoroughly investigated. In particular, the key UAV challenges such as 3D deployment, performance analysis, channel modeling, and energy efficiency are explored along with representative results. Then, open problems and potential research directions pertaining to UAV communications are introduced. Finally, various analytical frameworks and mathematical tools, such as optimization theory, machine learning, stochastic geometry, transport theory, and game theory are described. The use of such tools for addressing unique UAV problems is also presented. In a nutshell, this tutorial provides key guidelines on how to analyze, optimize, and design UAV-based wireless communication systems.|95d0dda7-5d58-4afd-b59f-315447b81992|IEEE Communications Surveys and Tutorials|A Tutorial on UAVs for Wireless Networks: Applications, Challenges, and Open Problems|2018|2250918;145412074;1702172;3223942;145118318|Mohammad Mozaffari;W. Saad;M. Bennis;Young-Han Nam;M. Debbah|Mathematics;Engineering;Computer Science
8515a302b8f389f8f1008cc2650e5ec0a6913e24|10.1109/MSP.2008.4408441|IEEE Signal Processing Magazine|41-56|Due to the volume conduction multichannel electroencephalogram (EEG) recordings give a rather blurred image of brain activity. Therefore spatial filters are extremely useful in single-trial analysis in order to improve the signal-to-noise ratio. There are powerful methods from machine learning and signal processing that permit the optimization of spatio-temporal filters for each subject in a data dependent fashion beyond the fixed filters based on the sensor geometry, e.g., Laplacians. Here we elucidate the theoretical background of the common spatial pattern (CSP) algorithm, a popular method in brain-computer interface (BCD research. Apart from reviewing several variants of the basic algorithm, we reveal tricks of the trade for achieving a powerful CSP performance, briefly elaborate on theoretical aspects of CSP, and demonstrate the application of CSP-type preprocessing in our studies of the Berlin BCI (BBCI) project.|f62e5eab-173a-4e0a-a963-ed8de9835d22|IEEE Signal Processing Magazine|Optimizing Spatial filters for Robust EEG Single-Trial Analysis|2008|3156886;2870603;3294736;1716788;72571095|B. Blankertz;Ryota Tomioka;S. Lemm;M. Kawanabe;K.-R. Muller|Engineering;Computer Science
21cea8f56a0d067d640f923b2d69e18ed5542f6d|10.1109/34.868684|IEEE Trans. Pattern Anal. Mach. Intell.|831-843|"We describe a real-time computer vision and machine learning system for modeling and recognizing human behaviors in a visual surveillance task. The system is particularly concerned with detecting when interactions between people occur, and classifying the type of interaction. Examples of interesting interaction behaviors include following another person, altering one's path to meet another, and so forth. Our system combines top-down with bottom-up information in a closed feedback loop, with both components employing a statistical Bayesian approach. We propose and compare two different state-based learning architectures, namely HMMs and CHMMs, for modeling behaviors and interactions. The CHMM model is shown to work much more efficiently and accurately. 
 
Finally, to deal with the problem of limited training data, a synthetic 'Alife-style' training system is used to develop flexible prior models for recognizing human interactions. We demonstrate the ability to use these a priori models to accurately classify real human behaviors and interactions with no additional tuning or training."|25248f80-fe99-48e5-9b8e-9baef3b8e23b|IEEE Transactions on Pattern Analysis and Machine Intelligence|A Bayesian Computer Vision System for Modeling Human Interactions|1999|145709776;3199842;144994682|Nuria Oliver;Barbara Rosario;A. Pentland|Computer Science
b8ebda42e272d3617375118542d4675a0c0e501d|10.1109/CVPR.2017.572|2017 IEEE Conference on Computer Vision and Pattern Recognition (CVPR)|5385-5394|In recent years, deep neural networks have emerged as a dominant machine learning tool for a wide variety of application domains. However, training a deep neural network requires a large amount of labeled data, which is an expensive process in terms of time, labor and human expertise. Domain adaptation or transfer learning algorithms address this challenge by leveraging labeled data in a different, but related source domain, to develop a model for the target domain. Further, the explosive growth of digital data has posed a fundamental challenge concerning its storage and retrieval. Due to its storage and retrieval efficiency, recent years have witnessed a wide application of hashing in a variety of computer vision applications. In this paper, we first introduce a new dataset, Office-Home, to evaluate domain adaptation algorithms. The dataset contains images of a variety of everyday objects from multiple domains. We then propose a novel deep learning framework that can exploit labeled source data and unlabeled target data to learn informative hash codes, to accurately classify unseen target data. To the best of our knowledge, this is the first research effort to exploit the feature learning capabilities of deep neural networks to learn representative hash codes to address the domain adaptation problem. Our extensive empirical studies on multiple transfer tasks corroborate the usefulness of the framework in learning efficient hash codes which outperform existing competitive baselines for unsupervised domain adaptation.|768b87bb-8a18-4d9c-a161-4d483c776bcf|Computer Vision and Pattern Recognition|Deep Hashing Network for Unsupervised Domain Adaptation|2017|3151995;2072459779;2471253;1743991|Hemanth Venkateswara;José Eusébio;Shayok Chakraborty;S. Panchanathan|Computer Science
f7d997a640f2b804676cadb8030d8b2c7bd79d85|10.5555/1756006.1859921|J. Mach. Learn. Res.|2079-2107|Model selection strategies for machine learning algorithms typically involve the numerical optimisation of an appropriate model selection criterion, often based on an estimator of generalisation performance, such as k-fold cross-validation. The error of such an estimator can be broken down into bias and variance components. While unbiasedness is often cited as a beneficial quality of a model selection criterion, we demonstrate that a low variance is at least as important, as a non-negligible variance introduces the potential for over-fitting in model selection as well as in training the model. While this observation is in hindsight perhaps rather obvious, the degradation in performance due to over-fitting the model selection criterion can be surprisingly large, an observation that appears to have received little attention in the machine learning literature to date. In this paper, we show that the effects of this form of over-fitting are often of comparable magnitude to differences in performance between learning algorithms, and thus cannot be ignored in empirical evaluation. Furthermore, we show that some common performance evaluation practices are susceptible to a form of selection bias as a result of this form of over-fitting and hence are unreliable. We discuss methods to avoid over-fitting in model selection and subsequent selection bias in performance evaluation, which we hope will be incorporated into best practice. While this study concentrates on cross-validation based model selection, the findings are quite general and apply to any model selection practice involving the optimisation of a model selection criterion evaluated over a finite sample of data, including maximisation of the Bayesian evidence and optimisation of performance bounds.|c22e7c36-3bfa-43e1-bb7b-edccdea2a780|Journal of machine learning research|On Over-fitting in Model Selection and Subsequent Selection Bias in Performance Evaluation|2010|8974886;28280741|G. Cawley;N. L. C. Talbot|Computer Science
a5d3a937e5ee43ab1542657ea2baf0c5cb139d6e|10.1109/TPAMI.2008.275|IEEE Transactions on Pattern Analysis and Machine Intelligence|105-119|The repeatability and efficiency of a corner detector determines how likely it is to be useful in a real-world application. The repeatability is important because the same scene viewed from different positions should yield features which correspond to the same real-world 3D locations. The efficiency is important because this determines whether the detector combined with further processing can operate at frame rate. Three advances are described in this paper. First, we present a new heuristic for feature detection and, using machine learning, we derive a feature detector from this which can fully process live PAL video using less than 5 percent of the available processing time. By comparison, most other detectors cannot even operate at frame rate (Harris detector 115 percent, SIFT 195 percent). Second, we generalize the detector, allowing it to be optimized for repeatability, with little loss of efficiency. Third, we carry out a rigorous comparison of corner detectors based on the above repeatability criterion applied to 3D scenes. We show that, despite being principally constructed for speed, on these stringent tests, our heuristic detector significantly outperforms existing feature detectors. Finally, the comparison demonstrates that using machine learning produces significant improvements in repeatability, yielding a detector that is both very fast and of very high quality.|25248f80-fe99-48e5-9b8e-9baef3b8e23b|IEEE Transactions on Pattern Analysis and Machine Intelligence|Faster and Better: A Machine Learning Approach to Corner Detection|2008|1721991;145881323;144418842|E. Rosten;R. Porter;T. Drummond|Medicine;Computer Science
467568f1777bc51a15a5100516cd4fe8de62b9ab|10.5555/1577069.1755839|J. Mach. Learn. Res.|1633-1685|The reinforcement learning paradigm is a popular way to address problems that have only limited environmental feedback, rather than correctly labeled examples, as is common in other machine learning contexts. While significant progress has been made to improve learning in a single task, the idea of transfer learning has only recently been applied to reinforcement learning tasks. The core idea of transfer is that experience gained in learning to perform one task can help improve learning performance in a related, but different, task. In this article we present a framework that classifies transfer learning methods in terms of their capabilities and goals, and then use it to survey the existing literature, as well as to suggest future directions for transfer learning work.|c22e7c36-3bfa-43e1-bb7b-edccdea2a780|Journal of machine learning research|Transfer Learning for Reinforcement Learning Domains: A Survey|2009|39286677;144848112|Matthew E. Taylor;P. Stone|Computer Science
2521c3d76bc439c961b7003080f4a7a661949547|10.1126/SCIENCE.1105809|Science|523 - 529|Machine learning was applied for the automated derivation of causal influences in cellular signaling networks. This derivation relied on the simultaneous measurement of multiple phosphorylated protein and phospholipid components in thousands of individual primary human immune system cells. Perturbing these cells with molecular interventions drove the ordering of connections between pathway components, wherein Bayesian network computational methods automatically elucidated most of the traditionally reported signaling relationships and predicted novel interpathway network causalities, which we verified experimentally. Reconstruction of network models from physiologically relevant primary single cells might be applied to understanding native-state tissue signaling biology, complex drug actions, and dysfunctional signaling in diseased cells.|f59506a8-d8bb-4101-b3d4-c4ac3ed03dad|Science|Causal Protein-Signaling Networks Derived from Multiparameter Single-Cell Data|2005|46599630;3289622;1397424343;1761370;1857137|K. Sachs;O. Perez;D. Pe’er;D. Lauffenburger;G. Nolan|Medicine;Biology;Computer Science
65b16da51891a6b98140d425804c8a0fd0299219|10.1109/CVPR.2017.35|2017 IEEE Conference on Computer Vision and Pattern Recognition (CVPR)|257-265|Non-uniform blind deblurring for general dynamic scenes is a challenging computer vision problem as blurs arise not only from multiple object motions but also from camera shake, scene depth variation. To remove these complicated motion blurs, conventional energy optimization based methods rely on simple assumptions such that blur kernel is partially uniform or locally linear. Moreover, recent machine learning based methods also depend on synthetic blur datasets generated under these assumptions. This makes conventional deblurring methods fail to remove blurs where blur kernel is difficult to approximate or parameterize (e.g. object motion boundaries). In this work, we propose a multi-scale convolutional neural network that restores sharp images in an end-to-end manner where blur is caused by various sources. Together, we present multi-scale loss function that mimics conventional coarse-to-fine approaches. Furthermore, we propose a new large-scale dataset that provides pairs of realistic blurry image and the corresponding ground truth sharp image that are obtained by a high-speed camera. With the proposed model trained on this dataset, we demonstrate empirically that our method achieves the state-of-the-art performance in dynamic scene deblurring not only qualitatively, but also quantitatively.|768b87bb-8a18-4d9c-a161-4d483c776bcf|Computer Vision and Pattern Recognition|Deep Multi-scale Convolutional Neural Network for Dynamic Scene Deblurring|2016|40648435;2111251935;2135837|Seungjun Nah;Tae Hyun Kim;Kyoung Mu Lee|Engineering;Computer Science
